{
  "$schema": "https://json-schema.org/draft/2020-12/schema",
  "$id": "zanni.join.schema.json",
  "additionalProperties": false,
  "description": "An actor asks to join. The join token travels in the HTTP `Authorization` header, never in the body.",
  "properties": {
    "kind": {
      "const": "zanni.join",
      "title": "Kind",
      "type": "string"
    },
    "card": {
      "additionalProperties": true,
      "description": "The actor's whole Agent Card, in A2A's JSON form.",
      "properties": {
        "capabilities": {
          "properties": {
            "extensions": {
              "contains": {
                "properties": {
                  "uri": {
                    "const": "https://github.com/alessioricco/Zanni/blob/master/docs/spec/casting-extension.md#v3"
                  }
                },
                "required": [
                  "uri",
                  "params"
                ],
                "type": "object"
              },
              "type": "array"
            }
          },
          "required": [
            "extensions"
          ],
          "type": "object"
        }
      },
      "required": [
        "capabilities"
      ],
      "title": "Card",
      "type": "object"
    },
    "part": {
      "anyOf": [
        {
          "minLength": 1,
          "type": "string"
        },
        {
          "type": "null"
        }
      ],
      "default": null,
      "description": "The part to join, when the role is cast for more than one.",
      "title": "Part"
    },
    "pricing": {
      "default": "unknown",
      "description": "`known` when every model the actor may use has a price; under a budget, `unknown` is refused with `unpriced` (D7, D39).",
      "enum": [
        "known",
        "unknown"
      ],
      "title": "Pricing",
      "type": "string"
    }
  },
  "required": [
    "kind",
    "card"
  ],
  "title": "Join",
  "type": "object"
}
